{
  "schemaVersion": 1,
  "execution": {
    "taskId": "42",
    "attempt": 1
  },
  "limitMicros": 1000000,
  "pricingSnapshot": {
    "schemaVersion": 1,
    "execution": {
      "taskId": "42",
      "attempt": 1
    },
    "modelConfigId": 2,
    "revision": 7,
    "capturedAt": "2026-10-27T00:00:00Z",
    "provider": "deepseek",
    "model": "deepseek-flash",
    "pricing": {
      "schemaVersion": 1,
      "currency": "USD",
      "unit": "per_million_tokens",
      "cacheMode": "input_only",
      "inputPerMillion": "1",
      "outputPerMillion": "4",
      "cacheReadPerMillion": null,
      "cacheWritePerMillion": null,
      "note": "Fixtures / Mock"
    },
    "reason": ""
  }
}
